                                                                                      Best trial: 12. Best value: 1.0309:  77%|███████▋  | 27/35 [2:09:41<39:04, 293.09s/it]Best trial: 12. Best value: 1.0309:  77%|███████▋  | 27/35 [2:09:41<39:04, 293.09s/it]Best trial: 12. Best value: 1.0309:  80%|████████  | 28/35 [2:09:41<32:37, 279.60s/it][I 2026-03-24 20:24:32,917] Trial 27 finished with value: 0.6134647859473178 and parameters: {'learning_rate': 7.407197799019769e-05, 'one_minus_gamma': 0.01097521167255168, 'buffer_size': 33624, 'batch_size_pow': 5, 'target_update_interval': 1550, 'exploration_fraction': 0.3486739148324471, 'exploration_final_eps': 0.030081449279087295, 'learning_starts': 3096, 'hidden_size': 64, 'total_timesteps': 300000, 'reward_type': 'sharpe'}. Best is trial 12 with value: 1.0309025745057685.
2026-03-24 20:29:50,191 __main__ Trial 28: Sharpe=0.678, CumRet=36.31%, MaxDD=14.02% (ts=350k, lr=1.5e-05, arch=256)
                                                                                      Best trial: 12. Best value: 1.0309:  80%|████████  | 28/35 [2:14:58<32:37, 279.60s/it]Best trial: 12. Best value: 1.0309:  80%|████████  | 28/35 [2:14:58<32:37, 279.60s/it]Best trial: 12. Best value: 1.0309:  83%|████████▎ | 29/35 [2:14:58<29:05, 290.90s/it][I 2026-03-24 20:29:50,191] Trial 28 finished with value: 0.6778759054192839 and parameters: {'learning_rate': 1.5181192113285042e-05, 'one_minus_gamma': 0.003699270083184125, 'buffer_size': 22478, 'batch_size_pow': 6, 'target_update_interval': 1086, 'exploration_fraction': 0.3036712456041373, 'exploration_final_eps': 0.06681461156830323, 'learning_starts': 2090, 'hidden_size': 256, 'total_timesteps': 350000, 'reward_type': 'sharpe'}. Best is trial 12 with value: 1.0309025745057685.
2026-03-24 20:36:18,717 __main__ Trial 29: Sharpe=0.293, CumRet=13.81%, MaxDD=21.12% (ts=400k, lr=4.0e-05, arch=64)
                                                                                      Best trial: 12. Best value: 1.0309:  83%|████████▎ | 29/35 [2:21:26<29:05, 290.90s/it]Best trial: 12. Best value: 1.0309:  83%|████████▎ | 29/35 [2:21:26<29:05, 290.90s/it]Best trial: 12. Best value: 1.0309:  86%|████████▌ | 30/35 [2:21:26<26:40, 320.19s/it][I 2026-03-24 20:36:18,717] Trial 29 finished with value: 0.29330187307795796 and parameters: {'learning_rate': 4.030600896938095e-05, 'one_minus_gamma': 0.008315195625108499, 'buffer_size': 61324, 'batch_size_pow': 7, 'target_update_interval': 309, 'exploration_fraction': 0.11466727783649613, 'exploration_final_eps': 0.015233313042493344, 'learning_starts': 3830, 'hidden_size': 64, 'total_timesteps': 400000, 'reward_type': 'return'}. Best is trial 12 with value: 1.0309025745057685.
2026-03-24 20:41:47,366 __main__ Trial 30: Sharpe=0.195, CumRet=9.00%, MaxDD=20.25% (ts=400k, lr=6.1e-05, arch=128)
                                                                                      Best trial: 12. Best value: 1.0309:  86%|████████▌ | 30/35 [2:26:55<26:40, 320.19s/it]Best trial: 12. Best value: 1.0309:  86%|████████▌ | 30/35 [2:26:55<26:40, 320.19s/it]Best trial: 12. Best value: 1.0309:  89%|████████▊ | 31/35 [2:26:55<21:30, 322.73s/it][I 2026-03-24 20:41:47,366] Trial 30 finished with value: 0.19492624804459624 and parameters: {'learning_rate': 6.053527979291531e-05, 'one_minus_gamma': 0.020634949933023936, 'buffer_size': 16146, 'batch_size_pow': 5, 'target_update_interval': 459, 'exploration_fraction': 0.3373888732199308, 'exploration_final_eps': 0.08146451441356117, 'learning_starts': 1590, 'hidden_size': 128, 'total_timesteps': 400000, 'reward_type': 'sharpe'}. Best is trial 12 with value: 1.0309025745057685.
2026-03-24 20:46:15,017 __main__ Trial 31: Sharpe=0.885, CumRet=48.97%, MaxDD=11.71% (ts=300k, lr=2.7e-05, arch=64)
                                                                                      Best trial: 12. Best value: 1.0309:  89%|████████▊ | 31/35 [2:31:23<21:30, 322.73s/it]Best trial: 12. Best value: 1.0309:  89%|████████▊ | 31/35 [2:31:23<21:30, 322.73s/it]Best trial: 12. Best value: 1.0309:  91%|█████████▏| 32/35 [2:31:23<15:18, 306.20s/it][I 2026-03-24 20:46:15,017] Trial 31 finished with value: 0.8852875729944986 and parameters: {'learning_rate': 2.7003086450086617e-05, 'one_minus_gamma': 0.0053659348525727235, 'buffer_size': 27702, 'batch_size_pow': 6, 'target_update_interval': 1949, 'exploration_fraction': 0.2228629993750954, 'exploration_final_eps': 0.05106467280223248, 'learning_starts': 4010, 'hidden_size': 64, 'total_timesteps': 300000, 'reward_type': 'sharpe'}. Best is trial 12 with value: 1.0309025745057685.
2026-03-24 20:51:27,466 __main__ Trial 32: Sharpe=1.017, CumRet=67.49%, MaxDD=12.77% (ts=350k, lr=1.8e-05, arch=64)
                                                                                      Best trial: 12. Best value: 1.0309:  91%|█████████▏| 32/35 [2:36:35<15:18, 306.20s/it]Best trial: 12. Best value: 1.0309:  91%|█████████▏| 32/35 [2:36:35<15:18, 306.20s/it]Best trial: 12. Best value: 1.0309:  94%|█████████▍| 33/35 [2:36:35<10:16, 308.08s/it][I 2026-03-24 20:51:27,466] Trial 32 finished with value: 1.017187604917858 and parameters: {'learning_rate': 1.8139994640801122e-05, 'one_minus_gamma': 0.00455869913755857, 'buffer_size': 30822, 'batch_size_pow': 6, 'target_update_interval': 1753, 'exploration_fraction': 0.1914274457454453, 'exploration_final_eps': 0.04774173781402459, 'learning_starts': 4694, 'hidden_size': 64, 'total_timesteps': 350000, 'reward_type': 'sharpe'}. Best is trial 12 with value: 1.0309025745057685.
2026-03-24 20:56:44,565 __main__ Trial 33: Sharpe=0.908, CumRet=54.17%, MaxDD=11.82% (ts=350k, lr=1.7e-05, arch=64)
                                                                                      Best trial: 12. Best value: 1.0309:  94%|█████████▍| 33/35 [2:41:52<10:16, 308.08s/it]Best trial: 12. Best value: 1.0309:  94%|█████████▍| 33/35 [2:41:52<10:16, 308.08s/it]Best trial: 12. Best value: 1.0309:  97%|█████████▋| 34/35 [2:41:52<05:10, 310.78s/it][I 2026-03-24 20:56:44,565] Trial 33 finished with value: 0.9083765496637414 and parameters: {'learning_rate': 1.7482167511241097e-05, 'one_minus_gamma': 0.00278748491013363, 'buffer_size': 38125, 'batch_size_pow': 6, 'target_update_interval': 1312, 'exploration_fraction': 0.13218216829367527, 'exploration_final_eps': 0.03663606946385198, 'learning_starts': 4787, 'hidden_size': 64, 'total_timesteps': 350000, 'reward_type': 'sharpe'}. Best is trial 12 with value: 1.0309025745057685.
2026-03-24 21:02:31,083 __main__ Trial 34: Sharpe=0.783, CumRet=41.87%, MaxDD=12.81% (ts=350k, lr=1.3e-05, arch=64)
                                                                                      Best trial: 12. Best value: 1.0309:  97%|█████████▋| 34/35 [2:47:39<05:10, 310.78s/it]Best trial: 12. Best value: 1.0309:  97%|█████████▋| 34/35 [2:47:39<05:10, 310.78s/it]Best trial: 12. Best value: 1.0309: 100%|██████████| 35/35 [2:47:39<00:00, 321.50s/it]Best trial: 12. Best value: 1.0309: 100%|██████████| 35/35 [2:47:39<00:00, 287.41s/it]
[I 2026-03-24 21:02:31,083] Trial 34 finished with value: 0.7826406785860076 and parameters: {'learning_rate': 1.3133667152845248e-05, 'one_minus_gamma': 0.002533671945794104, 'buffer_size': 21030, 'batch_size_pow': 7, 'target_update_interval': 1712, 'exploration_fraction': 0.1910893253218624, 'exploration_final_eps': 0.0646566749973699, 'learning_starts': 3396, 'hidden_size': 64, 'total_timesteps': 350000, 'reward_type': 'sharpe'}. Best is trial 12 with value: 1.0309025745057685.
2026-03-24 21:02:31,632 __main__ Saved best DQN hyperparameters to /home/poogee/kursach_2/configs/tuning_results/dqn_best_hyperparams.json
2026-03-24 21:02:31,635 __main__ Saved all 35 trials to /home/poogee/kursach_2/configs/tuning_results/dqn_all_trials.json

============================================================
DQN TUNING COMPLETE — 167.7 minutes
============================================================
Best Sharpe: 1.0309
Best params:
  learning_rate: 2.0810060317151663e-05
  one_minus_gamma: 0.0043787632821536485
  buffer_size: 16724
  batch_size_pow: 6
  target_update_interval: 679
  exploration_fraction: 0.2958789250122936
  exploration_final_eps: 0.07308061340465384
  learning_starts: 1636
  hidden_size: 64
  total_timesteps: 400000
  reward_type: sharpe

Parameter importance:
  reward_type: 0.3715
  exploration_final_eps: 0.1419
  one_minus_gamma: 0.1041
  batch_size_pow: 0.0929
  hidden_size: 0.0845
  learning_starts: 0.0587
  target_update_interval: 0.0458
  buffer_size: 0.0416
  learning_rate: 0.0272
  total_timesteps: 0.0173
  exploration_fraction: 0.0146
============================================================

