                                                                                      Best trial: 3. Best value: 0.897505:  11%|█▏        | 4/35 [27:39<2:53:09, 335.15s/it]Best trial: 4. Best value: 0.905372:  11%|█▏        | 4/35 [27:39<2:53:09, 335.15s/it]Best trial: 4. Best value: 0.905372:  14%|█▍        | 5/35 [27:39<2:43:08, 326.30s/it][I 2026-03-24 18:42:31,684] Trial 4 finished with value: 0.9053720867504971 and parameters: {'learning_rate': 1.4136637008121852e-05, 'one_minus_gamma': 0.0021526280972215283, 'buffer_size': 11097, 'batch_size_pow': 6, 'target_update_interval': 489, 'exploration_fraction': 0.1814047095321688, 'exploration_final_eps': 0.08458637582367365, 'learning_starts': 1136, 'hidden_size': 128, 'total_timesteps': 350000, 'reward_type': 'sharpe'}. Best is trial 4 with value: 0.9053720867504971.
2026-03-24 18:48:22,825 __main__ Trial 5: Sharpe=0.234, CumRet=10.67%, MaxDD=17.66% (ts=300k, lr=2.1e-04, arch=256)
                                                                                      Best trial: 4. Best value: 0.905372:  14%|█▍        | 5/35 [33:31<2:43:08, 326.30s/it]Best trial: 4. Best value: 0.905372:  14%|█▍        | 5/35 [33:31<2:43:08, 326.30s/it]Best trial: 4. Best value: 0.905372:  17%|█▋        | 6/35 [33:31<2:41:47, 334.74s/it][I 2026-03-24 18:48:22,825] Trial 5 finished with value: 0.2337551981656756 and parameters: {'learning_rate': 0.00020512599422151375, 'one_minus_gamma': 0.002175764980119757, 'buffer_size': 10127, 'batch_size_pow': 8, 'target_update_interval': 1018, 'exploration_fraction': 0.3187021504122962, 'exploration_final_eps': 0.07941433120173512, 'learning_starts': 592, 'hidden_size': 256, 'total_timesteps': 300000, 'reward_type': 'return'}. Best is trial 4 with value: 0.9053720867504971.
2026-03-24 18:52:28,967 __main__ Trial 6: Sharpe=0.063, CumRet=0.93%, MaxDD=19.79% (ts=250k, lr=3.4e-05, arch=256)
                                                                                      Best trial: 4. Best value: 0.905372:  17%|█▋        | 6/35 [37:37<2:41:47, 334.74s/it]Best trial: 4. Best value: 0.905372:  17%|█▋        | 6/35 [37:37<2:41:47, 334.74s/it]Best trial: 4. Best value: 0.905372:  20%|██        | 7/35 [37:37<2:22:41, 305.78s/it][I 2026-03-24 18:52:28,967] Trial 6 finished with value: 0.06250371722325213 and parameters: {'learning_rate': 3.3755895712060835e-05, 'one_minus_gamma': 0.003568426123255422, 'buffer_size': 53654, 'batch_size_pow': 7, 'target_update_interval': 1542, 'exploration_fraction': 0.2416644775485848, 'exploration_final_eps': 0.020763482134447155, 'learning_starts': 2583, 'hidden_size': 256, 'total_timesteps': 250000, 'reward_type': 'return'}. Best is trial 4 with value: 0.9053720867504971.
2026-03-24 18:54:02,554 __main__ Trial 7: Sharpe=0.166, CumRet=6.55%, MaxDD=17.29% (ts=100k, lr=1.1e-05, arch=128)
                                                                                      Best trial: 4. Best value: 0.905372:  20%|██        | 7/35 [39:10<2:22:41, 305.78s/it]Best trial: 4. Best value: 0.905372:  20%|██        | 7/35 [39:10<2:22:41, 305.78s/it]Best trial: 4. Best value: 0.905372:  23%|██▎       | 8/35 [39:10<1:47:12, 238.23s/it][I 2026-03-24 18:54:02,554] Trial 7 finished with value: 0.1658836535685403 and parameters: {'learning_rate': 1.1045524260304719e-05, 'one_minus_gamma': 0.0015251209898002925, 'buffer_size': 10750, 'batch_size_pow': 7, 'target_update_interval': 412, 'exploration_fraction': 0.25257120734941085, 'exploration_final_eps': 0.09168098265334837, 'learning_starts': 887, 'hidden_size': 128, 'total_timesteps': 100000, 'reward_type': 'return'}. Best is trial 4 with value: 0.9053720867504971.
2026-03-24 18:56:02,906 __main__ Trial 8: Sharpe=0.481, CumRet=26.55%, MaxDD=18.20% (ts=100k, lr=3.8e-04, arch=128)
                                                                                      Best trial: 4. Best value: 0.905372:  23%|██▎       | 8/35 [41:11<1:47:12, 238.23s/it]Best trial: 4. Best value: 0.905372:  23%|██▎       | 8/35 [41:11<1:47:12, 238.23s/it]Best trial: 4. Best value: 0.905372:  26%|██▌       | 9/35 [41:11<1:27:15, 201.38s/it][I 2026-03-24 18:56:02,906] Trial 8 finished with value: 0.48097560016561364 and parameters: {'learning_rate': 0.00037977679442478547, 'one_minus_gamma': 0.02360327600127809, 'buffer_size': 42993, 'batch_size_pow': 8, 'target_update_interval': 1272, 'exploration_fraction': 0.15597101766581076, 'exploration_final_eps': 0.090330309864098, 'learning_starts': 1730, 'hidden_size': 128, 'total_timesteps': 100000, 'reward_type': 'sharpe'}. Best is trial 4 with value: 0.9053720867504971.
2026-03-24 19:01:04,094 __main__ Trial 9: Sharpe=0.317, CumRet=15.11%, MaxDD=16.41% (ts=300k, lr=2.5e-04, arch=64)
                                                                                      Best trial: 4. Best value: 0.905372:  26%|██▌       | 9/35 [46:12<1:27:15, 201.38s/it]Best trial: 4. Best value: 0.905372:  26%|██▌       | 9/35 [46:12<1:27:15, 201.38s/it]Best trial: 4. Best value: 0.905372:  29%|██▊       | 10/35 [46:12<1:36:44, 232.19s/it][I 2026-03-24 19:01:04,094] Trial 9 finished with value: 0.3168239702348812 and parameters: {'learning_rate': 0.0002453480159918335, 'one_minus_gamma': 0.02899715852166589, 'buffer_size': 10161, 'batch_size_pow': 7, 'target_update_interval': 522, 'exploration_fraction': 0.1666323431412191, 'exploration_final_eps': 0.020787883060031452, 'learning_starts': 1087, 'hidden_size': 64, 'total_timesteps': 300000, 'reward_type': 'sharpe'}. Best is trial 4 with value: 0.9053720867504971.
2026-03-24 19:03:56,889 __main__ Trial 10: Sharpe=0.638, CumRet=36.73%, MaxDD=17.60% (ts=200k, lr=7.5e-05, arch=128)
                                                                                       Best trial: 4. Best value: 0.905372:  29%|██▊       | 10/35 [49:05<1:36:44, 232.19s/it]Best trial: 4. Best value: 0.905372:  29%|██▊       | 10/35 [49:05<1:36:44, 232.19s/it]Best trial: 4. Best value: 0.905372:  31%|███▏      | 11/35 [49:05<1:25:36, 214.01s/it][I 2026-03-24 19:03:56,889] Trial 10 finished with value: 0.6379565549552096 and parameters: {'learning_rate': 7.459309651146722e-05, 'one_minus_gamma': 0.008823974290385714, 'buffer_size': 93226, 'batch_size_pow': 5, 'target_update_interval': 873, 'exploration_fraction': 0.1116175599883549, 'exploration_final_eps': 0.04251807967976285, 'learning_starts': 1368, 'hidden_size': 128, 'total_timesteps': 200000, 'reward_type': 'sharpe'}. Best is trial 4 with value: 0.9053720867504971.
2026-03-24 19:09:53,779 __main__ Trial 11: Sharpe=0.729, CumRet=45.11%, MaxDD=15.33% (ts=400k, lr=1.0e-05, arch=64)
                                                                                       Best trial: 4. Best value: 0.905372:  31%|███▏      | 11/35 [55:01<1:25:36, 214.01s/it]Best trial: 4. Best value: 0.905372:  31%|███▏      | 11/35 [55:01<1:25:36, 214.01s/it]Best trial: 4. Best value: 0.905372:  34%|███▍      | 12/35 [55:01<1:38:41, 257.48s/it][I 2026-03-24 19:09:53,779] Trial 11 finished with value: 0.7291926996941378 and parameters: {'learning_rate': 1.0201380994826457e-05, 'one_minus_gamma': 0.010318151110851798, 'buffer_size': 19599, 'batch_size_pow': 6, 'target_update_interval': 356, 'exploration_fraction': 0.23724733930832337, 'exploration_final_eps': 0.056683466043722736, 'learning_starts': 509, 'hidden_size': 64, 'total_timesteps': 400000, 'reward_type': 'sharpe'}. Best is trial 4 with value: 0.9053720867504971.
2026-03-24 19:15:45,923 __main__ Trial 12: Sharpe=1.031, CumRet=66.86%, MaxDD=12.32% (ts=400k, lr=2.1e-05, arch=64)
                                                                                       Best trial: 4. Best value: 0.905372:  34%|███▍      | 12/35 [1:00:54<1:38:41, 257.48s/it]Best trial: 12. Best value: 1.0309:  34%|███▍      | 12/35 [1:00:54<1:38:41, 257.48s/it] Best trial: 12. Best value: 1.0309:  37%|███▋      | 13/35 [1:00:54<1:44:55, 286.16s/it][I 2026-03-24 19:15:45,923] Trial 12 finished with value: 1.0309025745057685 and parameters: {'learning_rate': 2.0810060317151663e-05, 'one_minus_gamma': 0.0043787632821536485, 'buffer_size': 16724, 'batch_size_pow': 6, 'target_update_interval': 679, 'exploration_fraction': 0.2958789250122936, 'exploration_final_eps': 0.07308061340465384, 'learning_starts': 1636, 'hidden_size': 64, 'total_timesteps': 400000, 'reward_type': 'sharpe'}. Best is trial 12 with value: 1.0309025745057685.
2026-03-24 19:20:51,905 __main__ Trial 13: Sharpe=0.970, CumRet=54.99%, MaxDD=11.03% (ts=350k, lr=2.4e-05, arch=64)
                                                                                        Best trial: 12. Best value: 1.0309:  37%|███▋      | 13/35 [1:06:00<1:44:55, 286.16s/it]Best trial: 12. Best value: 1.0309:  37%|███▋      | 13/35 [1:06:00<1:44:55, 286.16s/it]Best trial: 12. Best value: 1.0309:  40%|████      | 14/35 [1:06:00<1:42:15, 292.14s/it][I 2026-03-24 19:20:51,905] Trial 13 finished with value: 0.9698502086135804 and parameters: {'learning_rate': 2.4033968383357462e-05, 'one_minus_gamma': 0.004799678697055282, 'buffer_size': 15507, 'batch_size_pow': 6, 'target_update_interval': 767, 'exploration_fraction': 0.31557194613395856, 'exploration_final_eps': 0.07519597182410175, 'learning_starts': 1989, 'hidden_size': 64, 'total_timesteps': 350000, 'reward_type': 'sharpe'}. Best is trial 12 with value: 1.0309025745057685.
2026-03-24 19:25:58,822 __main__ Trial 14: Sharpe=0.640, CumRet=36.41%, MaxDD=15.15% (ts=350k, lr=3.5e-05, arch=64)
                                                                                        Best trial: 12. Best value: 1.0309:  40%|████      | 14/35 [1:11:07<1:42:15, 292.14s/it]Best trial: 12. Best value: 1.0309:  40%|████      | 14/35 [1:11:07<1:42:15, 292.14s/it]Best trial: 12. Best value: 1.0309:  43%|████▎     | 15/35 [1:11:07<1:38:51, 296.60s/it][I 2026-03-24 19:25:58,823] Trial 14 finished with value: 0.6396909292947358 and parameters: {'learning_rate': 3.488809662214908e-05, 'one_minus_gamma': 0.004508343279768397, 'buffer_size': 25043, 'batch_size_pow': 6, 'target_update_interval': 777, 'exploration_fraction': 0.3213641254010753, 'exploration_final_eps': 0.07196070713182776, 'learning_starts': 2169, 'hidden_size': 64, 'total_timesteps': 350000, 'reward_type': 'sharpe'}. Best is trial 12 with value: 1.0309025745057685.
2026-03-24 19:30:06,867 __main__ Trial 15: Sharpe=0.833, CumRet=52.74%, MaxDD=13.69% (ts=300k, lr=2.2e-05, arch=64)
                                                                                        Best trial: 12. Best value: 1.0309:  43%|████▎     | 15/35 [1:15:15<1:38:51, 296.60s/it]Best trial: 12. Best value: 1.0309:  43%|████▎     | 15/35 [1:15:15<1:38:51, 296.60s/it]Best trial: 12. Best value: 1.0309:  46%|████▌     | 16/35 [1:15:15<1:29:17, 281.98s/it][I 2026-03-24 19:30:06,867] Trial 15 finished with value: 0.8328795208879727 and parameters: {'learning_rate': 2.2431003046671357e-05, 'one_minus_gamma': 0.004435617445565818, 'buffer_size': 14853, 'batch_size_pow': 5, 'target_update_interval': 684, 'exploration_fraction': 0.32029322709984986, 'exploration_final_eps': 0.04073950854419432, 'learning_starts': 1929, 'hidden_size': 64, 'total_timesteps': 300000, 'reward_type': 'sharpe'}. Best is trial 12 with value: 1.0309025745057685.
2026-03-24 19:32:59,011 __main__ Trial 16: Sharpe=0.770, CumRet=45.61%, MaxDD=14.36% (ts=200k, lr=2.2e-05, arch=64)
                                                                                        Best trial: 12. Best value: 1.0309:  46%|████▌     | 16/35 [1:18:07<1:29:17, 281.98s/it]Best trial: 12. Best value: 1.0309:  46%|████▌     | 16/35 [1:18:07<1:29:17, 281.98s/it]Best trial: 12. Best value: 1.0309:  49%|████▊     | 17/35 [1:18:07<1:14:41, 248.95s/it][I 2026-03-24 19:32:59,011] Trial 16 finished with value: 0.7702993467217236 and parameters: {'learning_rate': 2.1927521932513402e-05, 'one_minus_gamma': 0.0148503319373719, 'buffer_size': 27295, 'batch_size_pow': 6, 'target_update_interval': 1983, 'exploration_fraction': 0.376989830492348, 'exploration_final_eps': 0.0740244394004506, 'learning_starts': 4616, 'hidden_size': 64, 'total_timesteps': 200000, 'reward_type': 'sharpe'}. Best is trial 12 with value: 1.0309025745057685.
2026-03-24 19:38:10,509 __main__ Trial 17: Sharpe=0.711, CumRet=38.64%, MaxDD=13.54% (ts=350k, lr=5.9e-05, arch=64)
                                                                                        Best trial: 12. Best value: 1.0309:  49%|████▊     | 17/35 [1:23:18<1:14:41, 248.95s/it]Best trial: 12. Best value: 1.0309:  49%|████▊     | 17/35 [1:23:18<1:14:41, 248.95s/it]Best trial: 12. Best value: 1.0309:  51%|█████▏    | 18/35 [1:23:18<1:15:51, 267.75s/it][I 2026-03-24 19:38:10,509] Trial 17 finished with value: 0.710962667829615 and parameters: {'learning_rate': 5.9429625189147085e-05, 'one_minus_gamma': 0.006073341327926475, 'buffer_size': 14603, 'batch_size_pow': 6, 'target_update_interval': 1051, 'exploration_fraction': 0.29710431214577293, 'exploration_final_eps': 0.04608696138870246, 'learning_starts': 1390, 'hidden_size': 64, 'total_timesteps': 350000, 'reward_type': 'sharpe'}. Best is trial 12 with value: 1.0309025745057685.
2026-03-24 19:43:24,897 __main__ Trial 18: Sharpe=0.733, CumRet=40.40%, MaxDD=13.72% (ts=400k, lr=1.2e-04, arch=64)
                                                                                        Best trial: 12. Best value: 1.0309:  51%|█████▏    | 18/35 [1:28:33<1:15:51, 267.75s/it]Best trial: 12. Best value: 1.0309:  51%|█████▏    | 18/35 [1:28:33<1:15:51, 267.75s/it]Best trial: 12. Best value: 1.0309:  54%|█████▍    | 19/35 [1:28:33<1:15:08, 281.76s/it][I 2026-03-24 19:43:24,897] Trial 18 finished with value: 0.7326194609965855 and parameters: {'learning_rate': 0.00012138695744414237, 'one_minus_gamma': 0.0030417213623880526, 'buffer_size': 13384, 'batch_size_pow': 5, 'target_update_interval': 652, 'exploration_fraction': 0.28649144472055865, 'exploration_final_eps': 0.06777578792612032, 'learning_starts': 2490, 'hidden_size': 64, 'total_timesteps': 400000, 'reward_type': 'return'}. Best is trial 12 with value: 1.0309025745057685.
2026-03-24 19:46:20,971 __main__ Trial 19: Sharpe=0.680, CumRet=39.92%, MaxDD=15.29% (ts=200k, lr=1.9e-05, arch=64)
                                                                                        Best trial: 12. Best value: 1.0309:  54%|█████▍    | 19/35 [1:31:29<1:15:08, 281.76s/it]Best trial: 12. Best value: 1.0309:  54%|█████▍    | 19/35 [1:31:29<1:15:08, 281.76s/it]Best trial: 12. Best value: 1.0309:  57%|█████▋    | 20/35 [1:31:29<1:02:30, 250.03s/it][I 2026-03-24 19:46:20,971] Trial 19 finished with value: 0.6798929553365152 and parameters: {'learning_rate': 1.8729432915408782e-05, 'one_minus_gamma': 0.014559095280735748, 'buffer_size': 23436, 'batch_size_pow': 6, 'target_update_interval': 846, 'exploration_fraction': 0.3551851397923907, 'exploration_final_eps': 0.08332478856535809, 'learning_starts': 1588, 'hidden_size': 64, 'total_timesteps': 200000, 'reward_type': 'sharpe'}. Best is trial 12 with value: 1.0309025745057685.
2026-03-24 19:51:16,963 __main__ Trial 20: Sharpe=0.991, CumRet=64.61%, MaxDD=14.24% (ts=350k, lr=3.2e-05, arch=64)
                                                                                        Best trial: 12. Best value: 1.0309:  57%|█████▋    | 20/35 [1:36:25<1:02:30, 250.03s/it]Best trial: 12. Best value: 1.0309:  57%|█████▋    | 20/35 [1:36:25<1:02:30, 250.03s/it]Best trial: 12. Best value: 1.0309:  60%|██████    | 21/35 [1:36:25<1:01:33, 263.82s/it][I 2026-03-24 19:51:16,963] Trial 20 finished with value: 0.9910022662040419 and parameters: {'learning_rate': 3.232951170419692e-05, 'one_minus_gamma': 0.006467923136113629, 'buffer_size': 34592, 'batch_size_pow': 5, 'target_update_interval': 1321, 'exploration_fraction': 0.21081532321593702, 'exploration_final_eps': 0.033052126611023934, 'learning_starts': 2893, 'hidden_size': 64, 'total_timesteps': 350000, 'reward_type': 'sharpe'}. Best is trial 12 with value: 1.0309025745057685.
2026-03-24 19:56:11,699 __main__ Trial 21: Sharpe=0.830, CumRet=50.89%, MaxDD=15.12% (ts=350k, lr=3.1e-05, arch=64)
                                                                                        Best trial: 12. Best value: 1.0309:  60%|██████    | 21/35 [1:41:19<1:01:33, 263.82s/it]Best trial: 12. Best value: 1.0309:  60%|██████    | 21/35 [1:41:19<1:01:33, 263.82s/it]Best trial: 12. Best value: 1.0309:  63%|██████▎   | 22/35 [1:41:19<59:10, 273.10s/it]  [I 2026-03-24 19:56:11,699] Trial 21 finished with value: 0.8303218391440929 and parameters: {'learning_rate': 3.0985544108037484e-05, 'one_minus_gamma': 0.006318563278845707, 'buffer_size': 42828, 'batch_size_pow': 5, 'target_update_interval': 1447, 'exploration_fraction': 0.21459988353719464, 'exploration_final_eps': 0.03548718277164127, 'learning_starts': 2974, 'hidden_size': 64, 'total_timesteps': 350000, 'reward_type': 'sharpe'}. Best is trial 12 with value: 1.0309025745057685.
2026-03-24 20:01:45,627 __main__ Trial 22: Sharpe=0.782, CumRet=45.14%, MaxDD=17.38% (ts=400k, lr=4.8e-05, arch=64)
                                                                                      Best trial: 12. Best value: 1.0309:  63%|██████▎   | 22/35 [1:46:53<59:10, 273.10s/it]Best trial: 12. Best value: 1.0309:  63%|██████▎   | 22/35 [1:46:53<59:10, 273.10s/it]Best trial: 12. Best value: 1.0309:  66%|██████▌   | 23/35 [1:46:53<58:16, 291.35s/it][I 2026-03-24 20:01:45,627] Trial 22 finished with value: 0.7816798181704109 and parameters: {'learning_rate': 4.842438549601388e-05, 'one_minus_gamma': 0.007692849992739992, 'buffer_size': 33654, 'batch_size_pow': 5, 'target_update_interval': 1212, 'exploration_fraction': 0.28129276439142836, 'exploration_final_eps': 0.028619744720765096, 'learning_starts': 2142, 'hidden_size': 64, 'total_timesteps': 400000, 'reward_type': 'sharpe'}. Best is trial 12 with value: 1.0309025745057685.
2026-03-24 20:06:14,007 __main__ Trial 23: Sharpe=0.919, CumRet=52.22%, MaxDD=13.28% (ts=300k, lr=2.8e-05, arch=64)
                                                                                      Best trial: 12. Best value: 1.0309:  66%|██████▌   | 23/35 [1:51:22<58:16, 291.35s/it]Best trial: 12. Best value: 1.0309:  66%|██████▌   | 23/35 [1:51:22<58:16, 291.35s/it]Best trial: 12. Best value: 1.0309:  69%|██████▊   | 24/35 [1:51:22<52:09, 284.46s/it][I 2026-03-24 20:06:14,007] Trial 23 finished with value: 0.9188063914238075 and parameters: {'learning_rate': 2.782489595003922e-05, 'one_minus_gamma': 0.004880927814375634, 'buffer_size': 30251, 'batch_size_pow': 6, 'target_update_interval': 1892, 'exploration_fraction': 0.2112180967834701, 'exploration_final_eps': 0.05149309391539499, 'learning_starts': 4046, 'hidden_size': 64, 'total_timesteps': 300000, 'reward_type': 'sharpe'}. Best is trial 12 with value: 1.0309025745057685.
2026-03-24 20:09:52,596 __main__ Trial 24: Sharpe=0.686, CumRet=36.78%, MaxDD=14.16% (ts=250k, lr=1.6e-05, arch=64)
                                                                                      Best trial: 12. Best value: 1.0309:  69%|██████▊   | 24/35 [1:55:00<52:09, 284.46s/it]Best trial: 12. Best value: 1.0309:  69%|██████▊   | 24/35 [1:55:00<52:09, 284.46s/it]Best trial: 12. Best value: 1.0309:  71%|███████▏  | 25/35 [1:55:00<44:06, 264.70s/it][I 2026-03-24 20:09:52,596] Trial 24 finished with value: 0.6862899391422718 and parameters: {'learning_rate': 1.606403136044622e-05, 'one_minus_gamma': 0.013073562739627266, 'buffer_size': 16743, 'batch_size_pow': 6, 'target_update_interval': 968, 'exploration_fraction': 0.35433376223178914, 'exploration_final_eps': 0.06112834211659691, 'learning_starts': 2499, 'hidden_size': 64, 'total_timesteps': 250000, 'reward_type': 'sharpe'}. Best is trial 12 with value: 1.0309025745057685.
2026-03-24 20:14:44,557 __main__ Trial 25: Sharpe=0.545, CumRet=27.64%, MaxDD=16.58% (ts=350k, lr=4.8e-05, arch=64)
                                                                                      Best trial: 12. Best value: 1.0309:  71%|███████▏  | 25/35 [1:59:52<44:06, 264.70s/it]Best trial: 12. Best value: 1.0309:  71%|███████▏  | 25/35 [1:59:52<44:06, 264.70s/it]Best trial: 12. Best value: 1.0309:  74%|███████▍  | 26/35 [1:59:52<40:55, 272.88s/it][I 2026-03-24 20:14:44,557] Trial 25 finished with value: 0.5445323947979738 and parameters: {'learning_rate': 4.779648619715359e-05, 'one_minus_gamma': 0.0031127304860023787, 'buffer_size': 73864, 'batch_size_pow': 5, 'target_update_interval': 736, 'exploration_fraction': 0.2696273366944877, 'exploration_final_eps': 0.07536275304357884, 'learning_starts': 1854, 'hidden_size': 64, 'total_timesteps': 350000, 'reward_type': 'sharpe'}. Best is trial 12 with value: 1.0309025745057685.
2026-03-24 20:20:24,807 __main__ Trial 26: Sharpe=0.171, CumRet=6.79%, MaxDD=20.21% (ts=400k, lr=2.6e-05, arch=64)
                                                                                      Best trial: 12. Best value: 1.0309:  74%|███████▍  | 26/35 [2:05:32<40:55, 272.88s/it]Best trial: 12. Best value: 1.0309:  74%|███████▍  | 26/35 [2:05:32<40:55, 272.88s/it]Best trial: 12. Best value: 1.0309:  77%|███████▋  | 27/35 [2:05:32<39:04, 293.09s/it][I 2026-03-24 20:20:24,807] Trial 26 finished with value: 0.17077886423058836 and parameters: {'learning_rate': 2.591372400592908e-05, 'one_minus_gamma': 0.005911654141869938, 'buffer_size': 12401, 'batch_size_pow': 6, 'target_update_interval': 592, 'exploration_fraction': 0.21706661362050444, 'exploration_final_eps': 0.05165023073442594, 'learning_starts': 1349, 'hidden_size': 64, 'total_timesteps': 400000, 'reward_type': 'return'}. Best is trial 12 with value: 1.0309025745057685.
2026-03-24 20:24:32,917 __main__ Trial 27: Sharpe=0.613, CumRet=33.78%, MaxDD=15.10% (ts=300k, lr=7.4e-05, arch=64)
