                                                                                          Best trial: 15. Best value: 0.365538:  54%|█████▍    | 19/35 [2:25:35<2:59:43, 673.95s/it]Best trial: 15. Best value: 0.365538:  54%|█████▍    | 19/35 [2:25:35<2:59:43, 673.95s/it]Best trial: 15. Best value: 0.365538:  57%|█████▋    | 20/35 [2:25:35<2:27:22, 589.53s/it][I 2026-03-24 15:38:12,112] Trial 19 finished with value: -0.8591425066799327 and parameters: {'learning_rate': 0.0003288394285566794, 'one_minus_gamma': 0.00523996494937563, 'clip_range': 0.3, 'n_steps_pow': 10, 'batch_size_pow': 6, 'n_epochs': 10, 'ent_coef': 0.001315136148274579, 'one_minus_gae': 0.010336985814593648, 'vf_coef': 0.5895107915786868, 'max_grad_norm': 0.6847595796360377, 'hidden_size': 128, 'total_timesteps': 350000, 'reward_type': 'return'}. Best is trial 15 with value: 0.3655377541402671.
2026-03-24 15:47:56,800 __main__ Trial 20: Sharpe=-2.100, CumRet=-67.73%, MaxDD=68.46% (ts=400k, lr=3.5e-04, arch=256)
                                                                                          Best trial: 15. Best value: 0.365538:  57%|█████▋    | 20/35 [2:35:20<2:27:22, 589.53s/it]Best trial: 15. Best value: 0.365538:  57%|█████▋    | 20/35 [2:35:20<2:27:22, 589.53s/it]Best trial: 15. Best value: 0.365538:  60%|██████    | 21/35 [2:35:20<2:17:13, 588.08s/it][I 2026-03-24 15:47:56,800] Trial 20 finished with value: -2.100020994728462 and parameters: {'learning_rate': 0.0003534553656075415, 'one_minus_gamma': 0.014466032237497173, 'clip_range': 0.3, 'n_steps_pow': 9, 'batch_size_pow': 6, 'n_epochs': 10, 'ent_coef': 0.013482708137375224, 'one_minus_gae': 0.021461766673466796, 'vf_coef': 0.4247830258580214, 'max_grad_norm': 0.7671172564717148, 'hidden_size': 256, 'total_timesteps': 400000, 'reward_type': 'return'}. Best is trial 15 with value: 0.3655377541402671.
2026-03-24 16:01:00,122 __main__ Trial 21: Sharpe=0.360, CumRet=19.06%, MaxDD=17.83% (ts=400k, lr=1.8e-04, arch=256)
                                                                                          Best trial: 15. Best value: 0.365538:  60%|██████    | 21/35 [2:48:23<2:17:13, 588.08s/it]Best trial: 15. Best value: 0.365538:  60%|██████    | 21/35 [2:48:23<2:17:13, 588.08s/it]Best trial: 15. Best value: 0.365538:  63%|██████▎   | 22/35 [2:48:23<2:20:06, 646.67s/it][I 2026-03-24 16:01:00,122] Trial 21 finished with value: 0.36017303885891044 and parameters: {'learning_rate': 0.00018394438733382144, 'one_minus_gamma': 0.02228252895351679, 'clip_range': 0.3, 'n_steps_pow': 9, 'batch_size_pow': 5, 'n_epochs': 10, 'ent_coef': 0.0007533194754050963, 'one_minus_gae': 0.02520940961877177, 'vf_coef': 0.4910896305323681, 'max_grad_norm': 0.402965145842785, 'hidden_size': 256, 'total_timesteps': 400000, 'reward_type': 'return'}. Best is trial 15 with value: 0.3655377541402671.
2026-03-24 16:12:12,364 __main__ Trial 22: Sharpe=0.066, CumRet=1.17%, MaxDD=19.23% (ts=350k, lr=1.5e-04, arch=256)
                                                                                          Best trial: 15. Best value: 0.365538:  63%|██████▎   | 22/35 [2:59:36<2:20:06, 646.67s/it]Best trial: 15. Best value: 0.365538:  63%|██████▎   | 22/35 [2:59:36<2:20:06, 646.67s/it]Best trial: 15. Best value: 0.365538:  66%|██████▌   | 23/35 [2:59:36<2:10:52, 654.35s/it][I 2026-03-24 16:12:12,364] Trial 22 finished with value: 0.06634718106207045 and parameters: {'learning_rate': 0.00015129167733286673, 'one_minus_gamma': 0.024646686216564052, 'clip_range': 0.3, 'n_steps_pow': 9, 'batch_size_pow': 5, 'n_epochs': 10, 'ent_coef': 0.0009356620335769753, 'one_minus_gae': 0.041923195649324466, 'vf_coef': 0.5608233943404755, 'max_grad_norm': 0.39271052207496937, 'hidden_size': 256, 'total_timesteps': 350000, 'reward_type': 'return'}. Best is trial 15 with value: 0.3655377541402671.
2026-03-24 16:25:02,638 __main__ Trial 23: Sharpe=0.102, CumRet=3.00%, MaxDD=18.34% (ts=400k, lr=2.4e-04, arch=256)
                                                                                          Best trial: 15. Best value: 0.365538:  66%|██████▌   | 23/35 [3:12:26<2:10:52, 654.35s/it]Best trial: 15. Best value: 0.365538:  66%|██████▌   | 23/35 [3:12:26<2:10:52, 654.35s/it]Best trial: 15. Best value: 0.365538:  69%|██████▊   | 24/35 [3:12:26<2:06:20, 689.13s/it][I 2026-03-24 16:25:02,638] Trial 23 finished with value: 0.10182001659869713 and parameters: {'learning_rate': 0.00024340430191672232, 'one_minus_gamma': 0.01598005645404669, 'clip_range': 0.3, 'n_steps_pow': 9, 'batch_size_pow': 5, 'n_epochs': 10, 'ent_coef': 0.0021779140409028197, 'one_minus_gae': 0.029974345928307288, 'vf_coef': 0.437437837949722, 'max_grad_norm': 0.5145380533489241, 'hidden_size': 256, 'total_timesteps': 400000, 'reward_type': 'return'}. Best is trial 15 with value: 0.3655377541402671.
2026-03-24 16:36:19,278 __main__ Trial 24: Sharpe=-0.389, CumRet=-20.41%, MaxDD=27.20% (ts=350k, lr=6.6e-05, arch=256)
                                                                                          Best trial: 15. Best value: 0.365538:  69%|██████▊   | 24/35 [3:23:43<2:06:20, 689.13s/it]Best trial: 15. Best value: 0.365538:  69%|██████▊   | 24/35 [3:23:43<2:06:20, 689.13s/it]Best trial: 15. Best value: 0.365538:  71%|███████▏  | 25/35 [3:23:43<1:54:13, 685.38s/it][I 2026-03-24 16:36:19,279] Trial 24 finished with value: -0.38862613943800844 and parameters: {'learning_rate': 6.578394833742175e-05, 'one_minus_gamma': 0.009851533314240355, 'clip_range': 0.3, 'n_steps_pow': 10, 'batch_size_pow': 5, 'n_epochs': 10, 'ent_coef': 0.0031755214953492995, 'one_minus_gae': 0.019732414304614435, 'vf_coef': 0.5006965069513736, 'max_grad_norm': 0.36939420229937897, 'hidden_size': 256, 'total_timesteps': 350000, 'reward_type': 'return'}. Best is trial 15 with value: 0.3655377541402671.
2026-03-24 16:49:10,701 __main__ Trial 25: Sharpe=0.304, CumRet=13.75%, MaxDD=17.09% (ts=400k, lr=5.0e-04, arch=256)
                                                                                          Best trial: 15. Best value: 0.365538:  71%|███████▏  | 25/35 [3:36:34<1:54:13, 685.38s/it]Best trial: 15. Best value: 0.365538:  71%|███████▏  | 25/35 [3:36:34<1:54:13, 685.38s/it]Best trial: 15. Best value: 0.365538:  74%|███████▍  | 26/35 [3:36:34<1:46:40, 711.20s/it][I 2026-03-24 16:49:10,701] Trial 25 finished with value: 0.30388727511148705 and parameters: {'learning_rate': 0.0004970681331486913, 'one_minus_gamma': 0.02803976217050191, 'clip_range': 0.3, 'n_steps_pow': 9, 'batch_size_pow': 5, 'n_epochs': 10, 'ent_coef': 0.000834678719085975, 'one_minus_gae': 0.029531104730619716, 'vf_coef': 0.6375275592595921, 'max_grad_norm': 0.5992676202880182, 'hidden_size': 256, 'total_timesteps': 400000, 'reward_type': 'return'}. Best is trial 15 with value: 0.3655377541402671.
2026-03-24 17:02:13,885 __main__ Trial 26: Sharpe=-0.345, CumRet=-19.46%, MaxDD=28.11% (ts=400k, lr=2.6e-04, arch=256)
                                                                                          Best trial: 15. Best value: 0.365538:  74%|███████▍  | 26/35 [3:49:37<1:46:40, 711.20s/it]Best trial: 15. Best value: 0.365538:  74%|███████▍  | 26/35 [3:49:37<1:46:40, 711.20s/it]Best trial: 15. Best value: 0.365538:  77%|███████▋  | 27/35 [3:49:37<1:37:42, 732.80s/it][I 2026-03-24 17:02:13,885] Trial 26 finished with value: -0.3452384542549328 and parameters: {'learning_rate': 0.00026417804814901316, 'one_minus_gamma': 0.00915281659459625, 'clip_range': 0.3, 'n_steps_pow': 10, 'batch_size_pow': 5, 'n_epochs': 10, 'ent_coef': 0.0052077868911478125, 'one_minus_gae': 0.04621682802896924, 'vf_coef': 0.3748506507729593, 'max_grad_norm': 0.5038794191497008, 'hidden_size': 256, 'total_timesteps': 400000, 'reward_type': 'sharpe'}. Best is trial 15 with value: 0.3655377541402671.
2026-03-24 17:10:40,060 __main__ Trial 27: Sharpe=0.452, CumRet=24.02%, MaxDD=22.22% (ts=350k, lr=1.8e-04, arch=256)
                                                                                          Best trial: 15. Best value: 0.365538:  77%|███████▋  | 27/35 [3:58:03<1:37:42, 732.80s/it]Best trial: 27. Best value: 0.45194:  77%|███████▋  | 27/35 [3:58:03<1:37:42, 732.80s/it] Best trial: 27. Best value: 0.45194:  80%|████████  | 28/35 [3:58:03<1:17:33, 664.81s/it][I 2026-03-24 17:10:40,061] Trial 27 finished with value: 0.45194008736328783 and parameters: {'learning_rate': 0.00017767286988055068, 'one_minus_gamma': 0.016986241307273265, 'clip_range': 0.3, 'n_steps_pow': 9, 'batch_size_pow': 6, 'n_epochs': 10, 'ent_coef': 0.0003057540337286385, 'one_minus_gae': 0.012420516295183528, 'vf_coef': 0.5174178598660641, 'max_grad_norm': 0.39687812987970894, 'hidden_size': 256, 'total_timesteps': 350000, 'reward_type': 'return'}. Best is trial 27 with value: 0.45194008736328783.
2026-03-24 17:16:18,643 __main__ Trial 28: Sharpe=-1.826, CumRet=-61.12%, MaxDD=63.21% (ts=350k, lr=6.2e-05, arch=64)
                                                                                         Best trial: 27. Best value: 0.45194:  80%|████████  | 28/35 [4:03:42<1:17:33, 664.81s/it]Best trial: 27. Best value: 0.45194:  80%|████████  | 28/35 [4:03:42<1:17:33, 664.81s/it]Best trial: 27. Best value: 0.45194:  83%|████████▎ | 29/35 [4:03:42<56:41, 566.94s/it]  [I 2026-03-24 17:16:18,643] Trial 28 finished with value: -1.8264321949664262 and parameters: {'learning_rate': 6.159410331900676e-05, 'one_minus_gamma': 0.0044431798914709615, 'clip_range': 0.3, 'n_steps_pow': 9, 'batch_size_pow': 6, 'n_epochs': 10, 'ent_coef': 0.00022783409573901543, 'one_minus_gae': 0.012053457784291764, 'vf_coef': 0.548653737119866, 'max_grad_norm': 0.3813040620008577, 'hidden_size': 64, 'total_timesteps': 350000, 'reward_type': 'return'}. Best is trial 27 with value: 0.45194008736328783.
2026-03-24 17:20:52,809 __main__ Trial 29: Sharpe=-1.248, CumRet=-46.80%, MaxDD=50.33% (ts=350k, lr=1.5e-04, arch=128)
                                                                                       Best trial: 27. Best value: 0.45194:  83%|████████▎ | 29/35 [4:08:16<56:41, 566.94s/it]Best trial: 27. Best value: 0.45194:  83%|████████▎ | 29/35 [4:08:16<56:41, 566.94s/it]Best trial: 27. Best value: 0.45194:  86%|████████▌ | 30/35 [4:08:16<39:55, 479.10s/it][I 2026-03-24 17:20:52,809] Trial 29 finished with value: -1.2476055754264095 and parameters: {'learning_rate': 0.000145909353472035, 'one_minus_gamma': 0.04888210929274903, 'clip_range': 0.3, 'n_steps_pow': 10, 'batch_size_pow': 7, 'n_epochs': 5, 'ent_coef': 0.0002870979662218276, 'one_minus_gae': 0.012238688119639981, 'vf_coef': 0.7018512487333105, 'max_grad_norm': 0.40639255079955267, 'hidden_size': 128, 'total_timesteps': 350000, 'reward_type': 'return'}. Best is trial 27 with value: 0.45194008736328783.
2026-03-24 17:28:10,809 __main__ Trial 30: Sharpe=0.255, CumRet=10.79%, MaxDD=19.05% (ts=300k, lr=2.2e-04, arch=256)
                                                                                       Best trial: 27. Best value: 0.45194:  86%|████████▌ | 30/35 [4:15:34<39:55, 479.10s/it]Best trial: 27. Best value: 0.45194:  86%|████████▌ | 30/35 [4:15:34<39:55, 479.10s/it]Best trial: 27. Best value: 0.45194:  89%|████████▊ | 31/35 [4:15:34<31:07, 466.77s/it][I 2026-03-24 17:28:10,809] Trial 30 finished with value: 0.255102497057349 and parameters: {'learning_rate': 0.0002155321266111466, 'one_minus_gamma': 0.016021929454881397, 'clip_range': 0.3, 'n_steps_pow': 8, 'batch_size_pow': 6, 'n_epochs': 10, 'ent_coef': 0.0003271394720811016, 'one_minus_gae': 0.01871858052657069, 'vf_coef': 0.6080105297550417, 'max_grad_norm': 0.42217775202061936, 'hidden_size': 256, 'total_timesteps': 300000, 'reward_type': 'return'}. Best is trial 27 with value: 0.45194008736328783.
2026-03-24 17:41:03,835 __main__ Trial 31: Sharpe=0.485, CumRet=28.74%, MaxDD=18.17% (ts=400k, lr=3.5e-04, arch=256)
                                                                                       Best trial: 27. Best value: 0.45194:  89%|████████▊ | 31/35 [4:28:27<31:07, 466.77s/it]Best trial: 31. Best value: 0.485324:  89%|████████▊ | 31/35 [4:28:27<31:07, 466.77s/it]Best trial: 31. Best value: 0.485324:  91%|█████████▏| 32/35 [4:28:27<27:55, 558.65s/it][I 2026-03-24 17:41:03,835] Trial 31 finished with value: 0.4853236295616343 and parameters: {'learning_rate': 0.0003473388501242811, 'one_minus_gamma': 0.01780135403357345, 'clip_range': 0.3, 'n_steps_pow': 9, 'batch_size_pow': 5, 'n_epochs': 10, 'ent_coef': 0.0008062688765483161, 'one_minus_gae': 0.02363930642751214, 'vf_coef': 0.46830458852937334, 'max_grad_norm': 0.5081023636086968, 'hidden_size': 256, 'total_timesteps': 400000, 'reward_type': 'return'}. Best is trial 31 with value: 0.4853236295616343.
2026-03-24 17:54:01,240 __main__ Trial 32: Sharpe=-0.161, CumRet=-8.24%, MaxDD=22.59% (ts=400k, lr=1.3e-04, arch=256)
                                                                                        Best trial: 31. Best value: 0.485324:  91%|█████████▏| 32/35 [4:41:25<27:55, 558.65s/it]Best trial: 31. Best value: 0.485324:  91%|█████████▏| 32/35 [4:41:25<27:55, 558.65s/it]Best trial: 31. Best value: 0.485324:  94%|█████████▍| 33/35 [4:41:25<20:48, 624.28s/it][I 2026-03-24 17:54:01,240] Trial 32 finished with value: -0.1609055178376979 and parameters: {'learning_rate': 0.0001271594814964095, 'one_minus_gamma': 0.008651391998861047, 'clip_range': 0.3, 'n_steps_pow': 9, 'batch_size_pow': 5, 'n_epochs': 10, 'ent_coef': 0.0010184599427516758, 'one_minus_gae': 0.021679126350424103, 'vf_coef': 0.5245808509709786, 'max_grad_norm': 0.467577728414934, 'hidden_size': 256, 'total_timesteps': 400000, 'reward_type': 'return'}. Best is trial 31 with value: 0.4853236295616343.
2026-03-24 18:07:01,376 __main__ Trial 33: Sharpe=-0.280, CumRet=-15.26%, MaxDD=27.41% (ts=400k, lr=3.8e-04, arch=256)
                                                                                        Best trial: 31. Best value: 0.485324:  94%|█████████▍| 33/35 [4:54:25<20:48, 624.28s/it]Best trial: 31. Best value: 0.485324:  94%|█████████▍| 33/35 [4:54:25<20:48, 624.28s/it]Best trial: 31. Best value: 0.485324:  97%|█████████▋| 34/35 [4:54:25<11:11, 671.03s/it][I 2026-03-24 18:07:01,376] Trial 33 finished with value: -0.27970872601935143 and parameters: {'learning_rate': 0.00038195243790754363, 'one_minus_gamma': 0.0010932927916845001, 'clip_range': 0.3, 'n_steps_pow': 9, 'batch_size_pow': 5, 'n_epochs': 10, 'ent_coef': 0.0007171447430222562, 'one_minus_gae': 0.0340611160422383, 'vf_coef': 0.387670396644769, 'max_grad_norm': 0.5782830478264941, 'hidden_size': 256, 'total_timesteps': 400000, 'reward_type': 'return'}. Best is trial 31 with value: 0.4853236295616343.
2026-03-24 18:14:51,335 __main__ Trial 34: Sharpe=0.341, CumRet=18.31%, MaxDD=19.02% (ts=350k, lr=1.8e-04, arch=256)
                                                                                        Best trial: 31. Best value: 0.485324:  97%|█████████▋| 34/35 [5:02:15<11:11, 671.03s/it]Best trial: 31. Best value: 0.485324:  97%|█████████▋| 34/35 [5:02:15<11:11, 671.03s/it]Best trial: 31. Best value: 0.485324: 100%|██████████| 35/35 [5:02:15<00:00, 610.71s/it]Best trial: 31. Best value: 0.485324: 100%|██████████| 35/35 [5:02:15<00:00, 518.15s/it]
[I 2026-03-24 18:14:51,335] Trial 34 finished with value: 0.3406735984978963 and parameters: {'learning_rate': 0.00017788821745652898, 'one_minus_gamma': 0.026647058367616175, 'clip_range': 0.3, 'n_steps_pow': 9, 'batch_size_pow': 5, 'n_epochs': 5, 'ent_coef': 0.0018606645621623836, 'one_minus_gae': 0.013522068408813974, 'vf_coef': 0.45278640322743074, 'max_grad_norm': 0.34515883806795056, 'hidden_size': 256, 'total_timesteps': 350000, 'reward_type': 'return'}. Best is trial 31 with value: 0.4853236295616343.
2026-03-24 18:14:51,815 __main__ Saved best PPO hyperparameters to /home/poogee/kursach_2/configs/tuning_results/ppo_best_hyperparams.json
2026-03-24 18:14:51,819 __main__ Saved all 35 trials to /home/poogee/kursach_2/configs/tuning_results/ppo_all_trials.json

============================================================
PPO TUNING COMPLETE — 302.3 minutes
============================================================
Best Sharpe: 0.4853
Best params:
  learning_rate: 0.0003473388501242811
  one_minus_gamma: 0.01780135403357345
  clip_range: 0.3
  n_steps_pow: 9
  batch_size_pow: 5
  n_epochs: 10
  ent_coef: 0.0008062688765483161
  one_minus_gae: 0.02363930642751214
  vf_coef: 0.46830458852937334
  max_grad_norm: 0.5081023636086968
  hidden_size: 256
  total_timesteps: 400000
  reward_type: return

Parameter importance:
  max_grad_norm: 0.3533
  one_minus_gamma: 0.2678
  hidden_size: 0.1106
  learning_rate: 0.0622
  batch_size_pow: 0.0606
  n_steps_pow: 0.0559
  one_minus_gae: 0.0319
  vf_coef: 0.0257
  clip_range: 0.0103
  ent_coef: 0.0090
  n_epochs: 0.0067
  reward_type: 0.0037
  total_timesteps: 0.0024
============================================================

2026-03-24 18:14:51,819 __main__ ============================================================
2026-03-24 18:14:51,819 __main__ Starting DQN hyperparameter tuning (35 trials)
2026-03-24 18:14:51,819 __main__ ============================================================
[I 2026-03-24 18:14:51,819] A new study created in memory with name: DQN_portfolio_tuning
  0%|          | 0/35 [00:00<?, ?it/s]2026-03-24 18:21:19,383 __main__ Trial 0: Sharpe=-0.272, CumRet=-16.25%, MaxDD=30.54% (ts=400k, lr=4.3e-05, arch=128)
                                        0%|          | 0/35 [06:27<?, ?it/s]Best trial: 0. Best value: -0.271795:   0%|          | 0/35 [06:27<?, ?it/s]Best trial: 0. Best value: -0.271795:   3%|▎         | 1/35 [06:27<3:39:37, 387.56s/it][I 2026-03-24 18:21:19,383] Trial 0 finished with value: -0.27179516999806197 and parameters: {'learning_rate': 4.3284502212938785e-05, 'one_minus_gamma': 0.04123206532618727, 'buffer_size': 53950, 'batch_size_pow': 7, 'target_update_interval': 286, 'exploration_fraction': 0.1467983561008608, 'exploration_final_eps': 0.015227525095137952, 'learning_starts': 3674, 'hidden_size': 128, 'total_timesteps': 400000, 'reward_type': 'return'}. Best is trial 0 with value: -0.27179516999806197.
2026-03-24 18:27:18,620 __main__ Trial 1: Sharpe=0.549, CumRet=29.45%, MaxDD=17.39% (ts=350k, lr=2.0e-05, arch=256)
                                                                                       Best trial: 0. Best value: -0.271795:   3%|▎         | 1/35 [12:26<3:39:37, 387.56s/it]Best trial: 1. Best value: 0.549046:   3%|▎         | 1/35 [12:26<3:39:37, 387.56s/it] Best trial: 1. Best value: 0.549046:   6%|▌         | 2/35 [12:26<3:23:59, 370.90s/it][I 2026-03-24 18:27:18,621] Trial 1 finished with value: 0.5490459195086822 and parameters: {'learning_rate': 2.0366442026830887e-05, 'one_minus_gamma': 0.002049268011541736, 'buffer_size': 20148, 'batch_size_pow': 7, 'target_update_interval': 540, 'exploration_fraction': 0.1873687420594126, 'exploration_final_eps': 0.06506676052501416, 'learning_starts': 689, 'hidden_size': 256, 'total_timesteps': 350000, 'reward_type': 'sharpe'}. Best is trial 1 with value: 0.5490459195086822.
2026-03-24 18:30:46,896 __main__ Trial 2: Sharpe=0.829, CumRet=47.82%, MaxDD=12.82% (ts=250k, lr=1.0e-04, arch=256)
                                                                                      Best trial: 1. Best value: 0.549046:   6%|▌         | 2/35 [15:55<3:23:59, 370.90s/it]Best trial: 2. Best value: 0.82884:   6%|▌         | 2/35 [15:55<3:23:59, 370.90s/it] Best trial: 2. Best value: 0.82884:   9%|▊         | 3/35 [15:55<2:38:12, 296.64s/it][I 2026-03-24 18:30:46,897] Trial 2 finished with value: 0.8288396256127957 and parameters: {'learning_rate': 0.0001015066704592858, 'one_minus_gamma': 0.0011992724522955163, 'buffer_size': 40508, 'batch_size_pow': 5, 'target_update_interval': 232, 'exploration_fraction': 0.384665661176, 'exploration_final_eps': 0.09690688297671035, 'learning_starts': 3216, 'hidden_size': 256, 'total_timesteps': 250000, 'reward_type': 'sharpe'}. Best is trial 2 with value: 0.8288396256127957.
2026-03-24 18:37:21,089 __main__ Trial 3: Sharpe=0.898, CumRet=50.80%, MaxDD=11.78% (ts=400k, lr=1.1e-05, arch=64)
                                                                                     Best trial: 2. Best value: 0.82884:   9%|▊         | 3/35 [22:29<2:38:12, 296.64s/it]Best trial: 3. Best value: 0.897505:   9%|▊         | 3/35 [22:29<2:38:12, 296.64s/it]Best trial: 3. Best value: 0.897505:  11%|█▏        | 4/35 [22:29<2:53:09, 335.15s/it][I 2026-03-24 18:37:21,089] Trial 3 finished with value: 0.8975049533920735 and parameters: {'learning_rate': 1.1439974749291259e-05, 'one_minus_gamma': 0.03506776499297219, 'buffer_size': 18145, 'batch_size_pow': 7, 'target_update_interval': 409, 'exploration_fraction': 0.2560204063533433, 'exploration_final_eps': 0.059203925140895175, 'learning_starts': 765, 'hidden_size': 64, 'total_timesteps': 400000, 'reward_type': 'sharpe'}. Best is trial 3 with value: 0.8975049533920735.
2026-03-24 18:42:31,684 __main__ Trial 4: Sharpe=0.905, CumRet=55.74%, MaxDD=11.74% (ts=350k, lr=1.4e-05, arch=128)
