2026-03-24 13:11:45,188 __main__ Loading data pipeline (n_assets=100)...
2026-03-24 13:11:45,188 src.data.pipeline Building data pipeline...
2026-03-24 13:11:45,188 src.data.loader Loading prices from /home/poogee/kursach_2/data/top3000_data_df.parquet
2026-03-24 13:11:51,088 src.data.loader Loaded prices: shape=(11346, 10611), date range=1979-12-31 00:00:00 to 2024-12-31 00:00:00
2026-03-24 13:11:51,088 src.data.loader Loading market_caps from /home/poogee/kursach_2/data/top3000_market_caps.parquet
2026-03-24 13:11:53,449 src.data.loader Loaded market_caps: shape=(11346, 10593), date range=1979-12-31 00:00:00 to 2024-12-31 00:00:00
2026-03-24 13:11:53,449 src.data.loader Loading dividends from /home/poogee/kursach_2/data/top3000_dividends.parquet
2026-03-24 13:11:54,181 src.data.loader Loaded dividends: shape=(11346, 10593), date range=1979-12-31 00:00:00 to 2024-12-31 00:00:00
2026-03-24 13:11:54,181 src.data.loader Loading presence from /home/poogee/kursach_2/data/top3000_presence_matrix.parquet
2026-03-24 13:11:55,075 src.data.loader Loaded presence: shape=(16438, 10593), date range=1979-12-31 00:00:00 to 2024-12-31 00:00:00
2026-03-24 13:11:55,076 src.data.pipeline Validating data integrity...
2026-03-24 13:11:57,320 src.data.pipeline 88179 negative/zero prices detected (0.2674% of non-NaN values)
2026-03-24 13:11:57,321 src.data.pipeline Data covers: prices 1979-12-31–2024-12-31 (11346 days), presence 1979-12-31–2024-12-31 (16438 days)
2026-03-24 13:11:57,333 src.data.pipeline 18 assets in prices but not in presence matrix: ['debt_issuance', 'low_leverage', 'profitability', 'short_term_reversal', 'spx_fut']...
2026-03-24 13:11:57,333 src.data.pipeline Validation passed.
2026-03-24 13:11:57,405 src.data.pipeline Common assets across all datasets: 10593
2026-03-24 13:12:08,201 src.data.universe UniverseSelector initialized with 10593 assets
2026-03-24 13:12:35,768 src.data.pipeline Pipeline complete — train: 5031 days, 274 assets; test: 1258 days, 142 assets
2026-03-24 13:12:35,857 __main__ Universe assets for training: 274
2026-03-24 13:12:35,857 __main__ Subsampled to 50 assets for tuning
2026-03-24 13:12:35,859 __main__ Train subset: 3521 days, Val subset: 1510 days, Assets: 50
2026-03-24 13:12:36,165 __main__ ============================================================
2026-03-24 13:12:36,165 __main__ Starting PPO hyperparameter tuning (35 trials)
2026-03-24 13:12:36,165 __main__ ============================================================
[I 2026-03-24 13:12:36,166] A new study created in memory with name: PPO_portfolio_tuning
  0%|          | 0/35 [00:00<?, ?it/s]2026-03-24 13:23:44,319 __main__ Trial 0: Sharpe=0.276, CumRet=12.08%, MaxDD=18.97% (ts=300k, lr=4.3e-05, arch=256)
                                        0%|          | 0/35 [11:08<?, ?it/s]Best trial: 0. Best value: 0.275748:   0%|          | 0/35 [11:08<?, ?it/s]Best trial: 0. Best value: 0.275748:   3%|▎         | 1/35 [11:08<6:18:37, 668.15s/it][I 2026-03-24 13:23:44,319] Trial 0 finished with value: 0.27574760142817084 and parameters: {'learning_rate': 4.3284502212938785e-05, 'one_minus_gamma': 0.04123206532618727, 'clip_range': 0.1, 'n_steps_pow': 8, 'batch_size_pow': 5, 'n_epochs': 3, 'ent_coef': 0.00011364672700011186, 'one_minus_gae': 0.09330606024425668, 'vf_coef': 0.8743319806003162, 'max_grad_norm': 0.44863737747479326, 'hidden_size': 256, 'total_timesteps': 300000, 'reward_type': 'return'}. Best is trial 0 with value: 0.27574760142817084.
2026-03-24 13:26:28,239 __main__ Trial 1: Sharpe=-1.669, CumRet=-62.86%, MaxDD=64.41% (ts=150k, lr=1.1e-04, arch=64)
                                                                                      Best trial: 0. Best value: 0.275748:   3%|▎         | 1/35 [13:52<6:18:37, 668.15s/it]Best trial: 0. Best value: 0.275748:   3%|▎         | 1/35 [13:52<6:18:37, 668.15s/it]Best trial: 0. Best value: 0.275748:   6%|▌         | 2/35 [13:52<3:24:20, 371.54s/it][I 2026-03-24 13:26:28,239] Trial 1 finished with value: -1.6690609054172816 and parameters: {'learning_rate': 0.00010952662748632558, 'one_minus_gamma': 0.0017258215396624998, 'clip_range': 0.3, 'n_steps_pow': 11, 'batch_size_pow': 5, 'n_epochs': 5, 'ent_coef': 0.004362599362560562, 'one_minus_gae': 0.014808945119975192, 'vf_coef': 0.29878869473895964, 'max_grad_norm': 0.9642198760773333, 'hidden_size': 64, 'total_timesteps': 150000, 'reward_type': 'return'}. Best is trial 0 with value: 0.27574760142817084.
2026-03-24 13:30:44,274 __main__ Trial 2: Sharpe=-1.456, CumRet=-56.76%, MaxDD=59.22% (ts=200k, lr=1.6e-05, arch=128)
                                                                                      Best trial: 0. Best value: 0.275748:   6%|▌         | 2/35 [18:08<3:24:20, 371.54s/it]Best trial: 0. Best value: 0.275748:   6%|▌         | 2/35 [18:08<3:24:20, 371.54s/it]Best trial: 0. Best value: 0.275748:   9%|▊         | 3/35 [18:08<2:50:01, 318.80s/it][I 2026-03-24 13:30:44,274] Trial 2 finished with value: -1.4557050671949898 and parameters: {'learning_rate': 1.6119044727609182e-05, 'one_minus_gamma': 0.0069389014127393955, 'clip_range': 0.2, 'n_steps_pow': 10, 'batch_size_pow': 5, 'n_epochs': 5, 'ent_coef': 0.04138851334163269, 'one_minus_gae': 0.05958443469672518, 'vf_coef': 0.9546242061731418, 'max_grad_norm': 0.9263791452993542, 'hidden_size': 128, 'total_timesteps': 200000, 'reward_type': 'sharpe'}. Best is trial 0 with value: 0.27574760142817084.
2026-03-24 13:36:51,337 __main__ Trial 3: Sharpe=-1.274, CumRet=-47.37%, MaxDD=49.67% (ts=150k, lr=4.6e-05, arch=256)
                                                                                      Best trial: 0. Best value: 0.275748:   9%|▊         | 3/35 [24:15<2:50:01, 318.80s/it]Best trial: 0. Best value: 0.275748:   9%|▊         | 3/35 [24:15<2:50:01, 318.80s/it]Best trial: 0. Best value: 0.275748:  11%|█▏        | 4/35 [24:15<2:54:33, 337.85s/it][I 2026-03-24 13:36:51,337] Trial 3 finished with value: -1.2739842926212082 and parameters: {'learning_rate': 4.574578205475403e-05, 'one_minus_gamma': 0.0028907721743726736, 'clip_range': 0.1, 'n_steps_pow': 10, 'batch_size_pow': 5, 'n_epochs': 10, 'ent_coef': 0.012141307774357374, 'one_minus_gae': 0.01580213186410389, 'vf_coef': 0.2541415878427018, 'max_grad_norm': 0.8708229999183839, 'hidden_size': 256, 'total_timesteps': 150000, 'reward_type': 'return'}. Best is trial 0 with value: 0.27574760142817084.
2026-03-24 13:40:17,983 __main__ Trial 4: Sharpe=-0.940, CumRet=-44.42%, MaxDD=48.21% (ts=250k, lr=2.9e-04, arch=64)
                                                                                      Best trial: 0. Best value: 0.275748:  11%|█▏        | 4/35 [27:41<2:54:33, 337.85s/it]Best trial: 0. Best value: 0.275748:  11%|█▏        | 4/35 [27:41<2:54:33, 337.85s/it]Best trial: 0. Best value: 0.275748:  14%|█▍        | 5/35 [27:41<2:25:16, 290.54s/it][I 2026-03-24 13:40:17,983] Trial 4 finished with value: -0.9397835804612826 and parameters: {'learning_rate': 0.0002926758115062131, 'one_minus_gamma': 0.011454201562599395, 'clip_range': 0.1, 'n_steps_pow': 9, 'batch_size_pow': 7, 'n_epochs': 5, 'ent_coef': 0.00021027192106506238, 'one_minus_gae': 0.05167075260023277, 'vf_coef': 0.8205887864626731, 'max_grad_norm': 0.6928940382986473, 'hidden_size': 64, 'total_timesteps': 250000, 'reward_type': 'sharpe'}. Best is trial 0 with value: 0.27574760142817084.
2026-03-24 13:43:17,544 __main__ Trial 5: Sharpe=-1.185, CumRet=-49.73%, MaxDD=52.57% (ts=200k, lr=1.1e-05, arch=128)
                                                                                      Best trial: 0. Best value: 0.275748:  14%|█▍        | 5/35 [30:41<2:25:16, 290.54s/it]Best trial: 0. Best value: 0.275748:  14%|█▍        | 5/35 [30:41<2:25:16, 290.54s/it]Best trial: 0. Best value: 0.275748:  17%|█▋        | 6/35 [30:41<2:02:11, 252.81s/it][I 2026-03-24 13:43:17,545] Trial 5 finished with value: -1.184912153617628 and parameters: {'learning_rate': 1.1308297976635991e-05, 'one_minus_gamma': 0.012057081573389115, 'clip_range': 0.3, 'n_steps_pow': 8, 'batch_size_pow': 6, 'n_epochs': 3, 'ent_coef': 0.0006053833609355686, 'one_minus_gae': 0.014495102383254688, 'vf_coef': 0.9472732392569299, 'max_grad_norm': 0.8656842656950918, 'hidden_size': 128, 'total_timesteps': 200000, 'reward_type': 'return'}. Best is trial 0 with value: 0.27574760142817084.
2026-03-24 13:47:45,116 __main__ Trial 6: Sharpe=-0.859, CumRet=-41.56%, MaxDD=45.86% (ts=350k, lr=2.4e-04, arch=64)
                                                                                      Best trial: 0. Best value: 0.275748:  17%|█▋        | 6/35 [35:08<2:02:11, 252.81s/it]Best trial: 0. Best value: 0.275748:  17%|█▋        | 6/35 [35:08<2:02:11, 252.81s/it]Best trial: 0. Best value: 0.275748:  20%|██        | 7/35 [35:08<2:00:13, 257.63s/it][I 2026-03-24 13:47:45,116] Trial 6 finished with value: -0.8590141199269625 and parameters: {'learning_rate': 0.00023540549916739863, 'one_minus_gamma': 0.03329908037586663, 'clip_range': 0.1, 'n_steps_pow': 9, 'batch_size_pow': 7, 'n_epochs': 3, 'ent_coef': 0.0013383810441801804, 'one_minus_gae': 0.016676611460145475, 'vf_coef': 0.3398990255002621, 'max_grad_norm': 0.5363306199825395, 'hidden_size': 64, 'total_timesteps': 350000, 'reward_type': 'sharpe'}. Best is trial 0 with value: 0.27574760142817084.
2026-03-24 13:52:35,263 __main__ Trial 7: Sharpe=-0.077, CumRet=-6.47%, MaxDD=23.25% (ts=350k, lr=4.3e-04, arch=64)
                                                                                      Best trial: 0. Best value: 0.275748:  20%|██        | 7/35 [39:59<2:00:13, 257.63s/it]Best trial: 0. Best value: 0.275748:  20%|██        | 7/35 [39:59<2:00:13, 257.63s/it]Best trial: 0. Best value: 0.275748:  23%|██▎       | 8/35 [39:59<2:00:35, 267.98s/it][I 2026-03-24 13:52:35,263] Trial 7 finished with value: -0.07696703787770422 and parameters: {'learning_rate': 0.00043168711384296114, 'one_minus_gamma': 0.0026777533310313258, 'clip_range': 0.1, 'n_steps_pow': 8, 'batch_size_pow': 6, 'n_epochs': 3, 'ent_coef': 0.028273682852605935, 'one_minus_gae': 0.017360486469796304, 'vf_coef': 0.3586711540684173, 'max_grad_norm': 0.642616932194294, 'hidden_size': 64, 'total_timesteps': 350000, 'reward_type': 'sharpe'}. Best is trial 0 with value: 0.27574760142817084.
2026-03-24 14:02:51,302 __main__ Trial 8: Sharpe=-0.940, CumRet=-41.94%, MaxDD=46.70% (ts=250k, lr=4.2e-05, arch=256)
                                                                                      Best trial: 0. Best value: 0.275748:  23%|██▎       | 8/35 [50:15<2:00:35, 267.98s/it]Best trial: 0. Best value: 0.275748:  23%|██▎       | 8/35 [50:15<2:00:35, 267.98s/it]Best trial: 0. Best value: 0.275748:  26%|██▌       | 9/35 [50:15<2:43:16, 376.79s/it][I 2026-03-24 14:02:51,302] Trial 8 finished with value: -0.9404848879248819 and parameters: {'learning_rate': 4.215533166949115e-05, 'one_minus_gamma': 0.011865024511462628, 'clip_range': 0.1, 'n_steps_pow': 11, 'batch_size_pow': 5, 'n_epochs': 10, 'ent_coef': 0.00674102423691786, 'one_minus_gae': 0.010389336884578963, 'vf_coef': 0.6340697937244607, 'max_grad_norm': 0.45854704263855656, 'hidden_size': 256, 'total_timesteps': 250000, 'reward_type': 'return'}. Best is trial 0 with value: 0.27574760142817084.
2026-03-24 14:09:46,075 __main__ Trial 9: Sharpe=-1.324, CumRet=-50.55%, MaxDD=51.60% (ts=400k, lr=3.8e-05, arch=256)
                                                                                      Best trial: 0. Best value: 0.275748:  26%|██▌       | 9/35 [57:09<2:43:16, 376.79s/it]Best trial: 0. Best value: 0.275748:  26%|██▌       | 9/35 [57:09<2:43:16, 376.79s/it]Best trial: 0. Best value: 0.275748:  29%|██▊       | 10/35 [57:09<2:41:52, 388.52s/it][I 2026-03-24 14:09:46,075] Trial 9 finished with value: -1.3237025505904245 and parameters: {'learning_rate': 3.797182755664945e-05, 'one_minus_gamma': 0.0015587917868879184, 'clip_range': 0.1, 'n_steps_pow': 10, 'batch_size_pow': 7, 'n_epochs': 3, 'ent_coef': 0.00017835347589260713, 'one_minus_gae': 0.07892521215168546, 'vf_coef': 0.9253135428724979, 'max_grad_norm': 0.7431710200912875, 'hidden_size': 256, 'total_timesteps': 400000, 'reward_type': 'return'}. Best is trial 0 with value: 0.27574760142817084.
2026-03-24 14:15:22,790 __main__ Trial 10: Sharpe=0.023, CumRet=-1.15%, MaxDD=24.29% (ts=300k, lr=8.7e-05, arch=256)
                                                                                       Best trial: 0. Best value: 0.275748:  29%|██▊       | 10/35 [1:02:46<2:41:52, 388.52s/it]Best trial: 0. Best value: 0.275748:  29%|██▊       | 10/35 [1:02:46<2:41:52, 388.52s/it]Best trial: 0. Best value: 0.275748:  31%|███▏      | 11/35 [1:02:46<2:29:03, 372.66s/it][I 2026-03-24 14:15:22,790] Trial 10 finished with value: 0.02312502076225772 and parameters: {'learning_rate': 8.73077078044857e-05, 'one_minus_gamma': 0.03845072704730259, 'clip_range': 0.2, 'n_steps_pow': 8, 'batch_size_pow': 6, 'n_epochs': 3, 'ent_coef': 0.00010986212855406446, 'one_minus_gae': 0.03970756686836501, 'vf_coef': 0.7033699697867272, 'max_grad_norm': 0.3086178186954562, 'hidden_size': 256, 'total_timesteps': 300000, 'reward_type': 'return'}. Best is trial 0 with value: 0.27574760142817084.
2026-03-24 14:21:03,683 __main__ Trial 11: Sharpe=-0.548, CumRet=-26.09%, MaxDD=31.76% (ts=300k, lr=1.0e-04, arch=256)
                                                                                         Best trial: 0. Best value: 0.275748:  31%|███▏      | 11/35 [1:08:27<2:29:03, 372.66s/it]Best trial: 0. Best value: 0.275748:  31%|███▏      | 11/35 [1:08:27<2:29:03, 372.66s/it]Best trial: 0. Best value: 0.275748:  34%|███▍      | 12/35 [1:08:27<2:19:08, 363.00s/it][I 2026-03-24 14:21:03,683] Trial 11 finished with value: -0.5483472140796894 and parameters: {'learning_rate': 0.00010002544034160116, 'one_minus_gamma': 0.049280906857438994, 'clip_range': 0.2, 'n_steps_pow': 8, 'batch_size_pow': 6, 'n_epochs': 3, 'ent_coef': 0.00010227296496273996, 'one_minus_gae': 0.032272314534068744, 'vf_coef': 0.6972913170901753, 'max_grad_norm': 0.3131879219272842, 'hidden_size': 256, 'total_timesteps': 300000, 'reward_type': 'return'}. Best is trial 0 with value: 0.27574760142817084.
2026-03-24 14:26:29,758 __main__ Trial 12: Sharpe=-0.623, CumRet=-28.33%, MaxDD=36.49% (ts=300k, lr=2.3e-05, arch=256)
                                                                                         Best trial: 0. Best value: 0.275748:  34%|███▍      | 12/35 [1:13:53<2:19:08, 363.00s/it]Best trial: 0. Best value: 0.275748:  34%|███▍      | 12/35 [1:13:53<2:19:08, 363.00s/it]Best trial: 0. Best value: 0.275748:  37%|███▋      | 13/35 [1:13:53<2:08:59, 351.81s/it][I 2026-03-24 14:26:29,758] Trial 12 finished with value: -0.6226482531308749 and parameters: {'learning_rate': 2.2570909164822985e-05, 'one_minus_gamma': 0.03065708402498615, 'clip_range': 0.2, 'n_steps_pow': 9, 'batch_size_pow': 6, 'n_epochs': 3, 'ent_coef': 0.0005120250297582433, 'one_minus_gae': 0.09933774318821907, 'vf_coef': 0.7679441387851931, 'max_grad_norm': 0.3131737592849248, 'hidden_size': 256, 'total_timesteps': 300000, 'reward_type': 'return'}. Best is trial 0 with value: 0.27574760142817084.
2026-03-24 14:33:43,730 __main__ Trial 13: Sharpe=0.168, CumRet=7.25%, MaxDD=23.48% (ts=350k, lr=1.4e-04, arch=256)
                                                                                         Best trial: 0. Best value: 0.275748:  37%|███▋      | 13/35 [1:21:07<2:08:59, 351.81s/it]Best trial: 0. Best value: 0.275748:  37%|███▋      | 13/35 [1:21:07<2:08:59, 351.81s/it]Best trial: 0. Best value: 0.275748:  40%|████      | 14/35 [1:21:07<2:11:49, 376.63s/it][I 2026-03-24 14:33:43,731] Trial 13 finished with value: 0.16761195156588884 and parameters: {'learning_rate': 0.000136254355432568, 'one_minus_gamma': 0.021573990016911276, 'clip_range': 0.2, 'n_steps_pow': 8, 'batch_size_pow': 5, 'n_epochs': 3, 'ent_coef': 0.00045063688308257937, 'one_minus_gae': 0.03577242727803139, 'vf_coef': 0.5396115304910807, 'max_grad_norm': 0.4525210432626959, 'hidden_size': 256, 'total_timesteps': 350000, 'reward_type': 'return'}. Best is trial 0 with value: 0.27574760142817084.
2026-03-24 14:42:06,431 __main__ Trial 14: Sharpe=0.278, CumRet=12.19%, MaxDD=15.66% (ts=400k, lr=1.9e-04, arch=256)
                                                                                         Best trial: 0. Best value: 0.275748:  40%|████      | 14/35 [1:29:30<2:11:49, 376.63s/it]Best trial: 14. Best value: 0.277974:  40%|████      | 14/35 [1:29:30<2:11:49, 376.63s/it]Best trial: 14. Best value: 0.277974:  43%|████▎     | 15/35 [1:29:30<2:18:12, 414.63s/it][I 2026-03-24 14:42:06,431] Trial 14 finished with value: 0.2779742038369499 and parameters: {'learning_rate': 0.0001885316688613296, 'one_minus_gamma': 0.020292205313044244, 'clip_range': 0.2, 'n_steps_pow': 8, 'batch_size_pow': 5, 'n_epochs': 3, 'ent_coef': 0.00047149755675596363, 'one_minus_gae': 0.025525514117921953, 'vf_coef': 0.48301706477349743, 'max_grad_norm': 0.4603035048912464, 'hidden_size': 256, 'total_timesteps': 400000, 'reward_type': 'return'}. Best is trial 14 with value: 0.2779742038369499.
2026-03-24 14:55:21,539 __main__ Trial 15: Sharpe=0.366, CumRet=17.71%, MaxDD=18.54% (ts=400k, lr=2.1e-04, arch=256)
                                                                                          Best trial: 14. Best value: 0.277974:  43%|████▎     | 15/35 [1:42:45<2:18:12, 414.63s/it]Best trial: 15. Best value: 0.365538:  43%|████▎     | 15/35 [1:42:45<2:18:12, 414.63s/it]Best trial: 15. Best value: 0.365538:  46%|████▌     | 16/35 [1:42:45<2:47:33, 529.15s/it][I 2026-03-24 14:55:21,539] Trial 15 finished with value: 0.3655377541402671 and parameters: {'learning_rate': 0.00021098456649883208, 'one_minus_gamma': 0.01984755039183199, 'clip_range': 0.3, 'n_steps_pow': 9, 'batch_size_pow': 5, 'n_epochs': 10, 'ent_coef': 0.001368025322175256, 'one_minus_gae': 0.02668988276105845, 'vf_coef': 0.48226253632699073, 'max_grad_norm': 0.534062747912732, 'hidden_size': 256, 'total_timesteps': 400000, 'reward_type': 'return'}. Best is trial 15 with value: 0.3655377541402671.
2026-03-24 15:05:16,047 __main__ Trial 16: Sharpe=-0.701, CumRet=-31.75%, MaxDD=37.71% (ts=400k, lr=1.8e-04, arch=128)
                                                                                          Best trial: 15. Best value: 0.365538:  46%|████▌     | 16/35 [1:52:39<2:47:33, 529.15s/it]Best trial: 15. Best value: 0.365538:  46%|████▌     | 16/35 [1:52:39<2:47:33, 529.15s/it]Best trial: 15. Best value: 0.365538:  49%|████▊     | 17/35 [1:52:39<2:44:38, 548.81s/it][I 2026-03-24 15:05:16,047] Trial 16 finished with value: -0.7011451912593265 and parameters: {'learning_rate': 0.00018378095026318328, 'one_minus_gamma': 0.006239651255647094, 'clip_range': 0.3, 'n_steps_pow': 9, 'batch_size_pow': 5, 'n_epochs': 10, 'ent_coef': 0.001464101584199406, 'one_minus_gae': 0.025717006971109454, 'vf_coef': 0.49105336668876387, 'max_grad_norm': 0.5879049789653259, 'hidden_size': 128, 'total_timesteps': 400000, 'reward_type': 'return'}. Best is trial 15 with value: 0.3655377541402671.
2026-03-24 15:18:14,846 __main__ Trial 17: Sharpe=0.327, CumRet=15.32%, MaxDD=18.91% (ts=400k, lr=4.8e-04, arch=256)
                                                                                          Best trial: 15. Best value: 0.365538:  49%|████▊     | 17/35 [2:05:38<2:44:38, 548.81s/it]Best trial: 15. Best value: 0.365538:  49%|████▊     | 17/35 [2:05:38<2:44:38, 548.81s/it]Best trial: 15. Best value: 0.365538:  51%|█████▏    | 18/35 [2:05:38<2:55:04, 617.92s/it][I 2026-03-24 15:18:14,847] Trial 17 finished with value: 0.3273404774884884 and parameters: {'learning_rate': 0.0004828694315445062, 'one_minus_gamma': 0.019118357399388806, 'clip_range': 0.3, 'n_steps_pow': 9, 'batch_size_pow': 5, 'n_epochs': 10, 'ent_coef': 0.002527606546662077, 'one_minus_gae': 0.02486150446881372, 'vf_coef': 0.47236582025789536, 'max_grad_norm': 0.5218346611516853, 'hidden_size': 256, 'total_timesteps': 400000, 'reward_type': 'return'}. Best is trial 15 with value: 0.3655377541402671.
2026-03-24 15:31:39,327 __main__ Trial 18: Sharpe=0.188, CumRet=7.76%, MaxDD=18.41% (ts=400k, lr=4.8e-04, arch=256)
                                                                                          Best trial: 15. Best value: 0.365538:  51%|█████▏    | 18/35 [2:19:03<2:55:04, 617.92s/it]Best trial: 15. Best value: 0.365538:  51%|█████▏    | 18/35 [2:19:03<2:55:04, 617.92s/it]Best trial: 15. Best value: 0.365538:  54%|█████▍    | 19/35 [2:19:03<2:59:43, 673.95s/it][I 2026-03-24 15:31:39,327] Trial 18 finished with value: 0.18795047416605845 and parameters: {'learning_rate': 0.0004813318785773142, 'one_minus_gamma': 0.02027712331490698, 'clip_range': 0.3, 'n_steps_pow': 9, 'batch_size_pow': 5, 'n_epochs': 10, 'ent_coef': 0.002837059685861586, 'one_minus_gae': 0.023324947638332996, 'vf_coef': 0.4200284031374009, 'max_grad_norm': 0.5554753058621937, 'hidden_size': 256, 'total_timesteps': 400000, 'reward_type': 'sharpe'}. Best is trial 15 with value: 0.3655377541402671.
2026-03-24 15:38:12,112 __main__ Trial 19: Sharpe=-0.859, CumRet=-37.59%, MaxDD=42.58% (ts=350k, lr=3.3e-04, arch=128)
